{
  "schema": "showcase-bundle/1",
  "bundle_id": "fx-negatives",
  "kind": "fixture",
  "simulated": false,
  "title": "Fixture: negative results (frontier wins ℓ ≤ 3, a DORMANT loop, FGR above bound)",
  "created_at": "2026-10-01T05:00:00Z",
  "featured": false,
  "experiment_ids": ["FIXTURE"],
  "run_ids": ["run-fx-negatives-01", "run-fx-negatives-02", "run-fx-negatives-03"],
  "harness_commit": "0000000fixture",
  "dirty": false,
  "analysis_commit": "0000000fixture",
  "config_hashes": ["b3:fixture"],
  "price_snapshot_id": "prices-2026-09-28",
  "models": ["cerebras/gpt-oss-120b", "claude-opus-5-5", "claude-sonnet-5"],
  "views": ["overview", "p1-head-to-head", "m4-audits"],
  "cost_usd": 0.0,
  "redaction": {
    "transcripts": "excluded",
    "prompts": "sha256",
    "hidden_tests": "sha256",
    "diffs": "included"
  },
  "files": [
    {
      "path": "data/metrics.jsonl",
      "schema": "vb.metric_record/1",
      "sha256": "7415ebb9584ebf71ba72acdd948dd5c8f449865f0674de6b9757c04e193efdc2",
      "rows": 43
    }
  ],
  "reproduce": ["fixture: hand-written test data for the showcase specs, not a measurement"]
}
