{
  "schema": "showcase-bundle/1",
  "bundle_id": "fx-golden",
  "kind": "fixture",
  "simulated": false,
  "title": "Fixture: P1 head-to-head and M4 audits (golden)",
  "created_at": "2026-10-01T06:00:00Z",
  "featured": true,
  "experiment_ids": ["FIXTURE"],
  "run_ids": ["run-fx-golden-01", "run-fx-golden-02", "run-fx-golden-03"],
  "harness_commit": "0000000fixture",
  "dirty": false,
  "analysis_commit": "0000000fixture",
  "config_hashes": ["b3:fixture"],
  "price_snapshot_id": "prices-2026-09-28",
  "models": ["cerebras/gpt-oss-120b", "claude-opus-5-5", "claude-sonnet-5"],
  "views": ["overview", "p1-head-to-head", "m4-audits"],
  "cost_usd": 0.0,
  "redaction": {
    "transcripts": "excluded",
    "prompts": "sha256",
    "hidden_tests": "sha256",
    "diffs": "included"
  },
  "files": [
    {
      "path": "data/metrics.jsonl",
      "schema": "vb.metric_record/1",
      "sha256": "255f3b780fc94635947ce2f32da9d345ae4df099848bb7ffa606ff628f0d6b65",
      "rows": 43
    }
  ],
  "reproduce": ["fixture: hand-written test data for the showcase specs, not a measurement"]
}
