{
  "schema": "showcase-bundle/1",
  "bundle_id": "fx-poison-tampered",
  "kind": "fixture",
  "simulated": false,
  "title": "Poisoned fixture: a view edited after SHA256SUMS",
  "created_at": "2026-09-29T00:01:00Z",
  "featured": false,
  "experiment_ids": ["FIXTURE"],
  "run_ids": [
    "run-fx-poison-tampered-01",
    "run-fx-poison-tampered-02",
    "run-fx-poison-tampered-03"
  ],
  "harness_commit": "0000000fixture",
  "dirty": false,
  "analysis_commit": "0000000fixture",
  "config_hashes": ["b3:fixture"],
  "price_snapshot_id": "prices-2026-09-28",
  "models": ["cerebras/gpt-oss-120b", "claude-opus-5-5", "claude-sonnet-5"],
  "views": ["overview", "p1-head-to-head", "m4-audits"],
  "cost_usd": 0.0,
  "redaction": {
    "transcripts": "excluded",
    "prompts": "sha256",
    "hidden_tests": "sha256",
    "diffs": "included"
  },
  "files": [
    {
      "path": "data/metrics.jsonl",
      "schema": "vb.metric_record/1",
      "sha256": "6e2fd700e870f0f9d4e34397b3fe75e2cfbab49234d4feb7d0cbbca1ba212fc9",
      "rows": 43
    }
  ],
  "reproduce": ["fixture: hand-written test data for the showcase specs, not a measurement"]
}
