{
  "schema": "showcase-bundle/1",
  "bundle_id": "fx-poison-no-run-ids",
  "kind": "fixture",
  "simulated": false,
  "title": "Poisoned fixture: no run ids",
  "created_at": "2026-09-29T00:02:00Z",
  "featured": false,
  "experiment_ids": ["FIXTURE"],
  "run_ids": [],
  "harness_commit": "0000000fixture",
  "dirty": false,
  "analysis_commit": "0000000fixture",
  "config_hashes": ["b3:fixture"],
  "price_snapshot_id": "prices-2026-09-28",
  "models": ["cerebras/gpt-oss-120b", "claude-opus-5-5", "claude-sonnet-5"],
  "views": ["overview", "p1-head-to-head", "m4-audits"],
  "cost_usd": 0.0,
  "redaction": {
    "transcripts": "excluded",
    "prompts": "sha256",
    "hidden_tests": "sha256",
    "diffs": "included"
  },
  "files": [
    {
      "path": "data/metrics.jsonl",
      "schema": "vb.metric_record/1",
      "sha256": "1bbc74edb3c690e452988ff9323ad25569a2ba7ccc8b7832c37e0965a164c053",
      "rows": 43
    }
  ],
  "reproduce": ["fixture: hand-written test data for the showcase specs, not a measurement"]
}
